OverallRating,Comment,FeedbackCategory,Subcategory
2,"I have been a member of scholastic for over 30 years. The quality of reading of your product has gone down, in my opinion. There are not enough classic stories, too many graphic novels, and silly stories (Dog man, etc..) and these kind of books do not make my students smarter readers. I know these are the type of books that sell, but , in my opinion, they lower Scholastic's standards.",Uncategorized,Products Offered
4,"We really wanted to purchase individual titles of the Owl Diaries, but they were not available.",Uncategorized,Single Titles vs Bundles
3,What my child wanted was out of stock,Uncategorized,Product Inventory
4,Not enough non-fiction or STEM related books selections,Uncategorized,Products Offered
4,I wish that scholastic carried,Uncategorized,Products Offered
3,I couldn't find some books my daughter wanted.,Uncategorized,Product Inventory
4,Would like to order individual books from the black is beautiful 5 pack,Uncategorized,Single Titles vs Bundles
4,I was interested in many of the book packs but already own 1 or 2 in most of them and wish the titles that you were interested in were available to purchase on their own.,Uncategorized,Single Titles vs Bundles
2,Get this woke crap off your site. The more woke stuff there is the less I buy. Shame.,Uncategorized,Products Offered
5,"Biggest challenge was figuring out which books were in a boxed series. I was shopping for the Magic Tree House series and needed a specific ""next"" box set. I couldn't easily distinguish which set was the correct one for me to select",Uncategorized,Product Info/Description
3,"For books that are part of a series, I wish you would say which number it is. As an example, I know my son likes The Bad Guys, but I don't know which numbers you have for sale.",Uncategorized,Product Info/Description
4,Not all books are available that are available on the regular of scholastic,Uncategorized,Product Inventory
1, book clubs has a lot fewer options.  ended up buying at amazon.,Uncategorized,Products Offered
2,I have not been able to intentionally get to a place to input the code from my flyer,Website,Digital Flyer
1,still can not find where the editable flier is to send home,Website,Digital Flyer
3,Letter to parents downloaded blank.,Website,Parent Letter
3,Hard to find information. Video tutorials would be nice.,Website,Userability/Performance/Navigation
5,"On the mobile app, I was trying to add the ""READS"" free book, but the ""confirm and apply"" button was below the screen and I couldn't scroll far enough to be able to click it. On the computer it worked fine.",Website,Mobile Compatibility
4,Took me awhile.  Not super user friendly.,Website,Userability/Performance/Navigation
3,Not finding info,Website,Userability/Performance/Navigation
3,Need larger pictures to show children the available books.,Website,Userability/Performance/Navigation
4,"Easy to add items to wish list and cart. Sometimes navigation is difficult (e.g., once get to checkout, it would be nice to have a back button ('back to shopping'), rather than using the browser back button or having to go back 'home' and navigate back to where I was before entering checkout).",Website,Userability/Performance/Navigation
3,"I had trouble finding where to submit my child’s teacher & when I found it, my entire cart was deleted so I had to start over. It would be better if the scholastic site worked seamlessly with the school classroom pages.",Website,Shopping Cart/Checkout
2,It will not add to my cart at all and I can't order.    I have a credit that I can't use.,Website,Shopping Cart/Checkout
5,"Site worked great! The search function under the site search was a little confusing since it only had the ""add to cart"" button there instead of going to the item to view the descrip. I get the idea of it, just wasn't prepared for it. This is so much easier than filling out those awful newsprint, tiny order forms lol",Website,Filter/Search Options
4,I feel like there should be an easier search function,Website,Filter/Search Options
5,Wish there was a way to edit a letter to attach to the student flyers.      Such as fonts and size.  I can't figure that out.,Website,Parent Letter
3,Search function is not great,Website,Filter/Search Options
3,Had trouble going back to the $1.00 page : D,Website,Userability/Performance/Navigation
3,The site is not easy to navigate.  I feel like you have to click around a lot to find the best deals for teachers.,Website,Userability/Performance/Navigation
3,"I find the site has not been updated in 3 years, since I was last in the classroom. It is not the most user-friendly to maneuver in between the teacher wish list and book selecting. I wish multiple books could be added at once instead of one at a time.     It would be nice to have received physical copies of flyers.",Website,Userability/Performance/Navigation
4,Just still looking for where to do this. :),Website,Userability/Performance/Navigation
3,Not an easy site to navigate and prices have gone up.,Website,Userability/Performance/Navigation
3,It is still not easy to quickly find what I want and switch back and forth between items.,Website,Filter/Search Options
3,"Your site is not easy to follow to order the books. I had to use the sheets that were sent home from the school and then search for each book using the item number. I was not impressed with the site. I would recommend the books, but I would also warn everyone about using the site.",Website,Userability/Performance/Navigation
3,"should be able to place books in ""shopping cart"" directly from the digital flyer. The numbers on the digital flyer are too small to easily read. Should be listed when click on the book.",Website,Userability/Performance/Navigation
4,Kept freezing on the flyer's.,Website,Digital Flyer
4,"I could not print my printable teacher letter - I got a screen with ""bad response"" instead.  I opened it in an incognito window and it worked.",Website,Parent Letter
1,when I am at checkout and have $ to use - I should be able to pull up my wish list and add those books in.  This is very frustrating.  The system really needs to be easier for teachers.  We don't have time to navigate back and forth.,Website,Userability/Performance/Navigation
5,very well placed categories ans recommendations. Only feedback is that when I was on a recommendation page I liked 2 books and I clicked on 1 to add to cart but after that I couldnot go back to the same recommendation page and missed the second book I had liked. I then had to search for it again.,Website,Userability/Performance/Navigation
3,The survey popped up before I could complete what I was doing.,Website,Survey Pop Up
4,Sometimes I find it hard to locate the collection deals or the book of the week sale,Website,Filter/Search Options
4,I am not sure that the entire process is intuitive but I am muddling through.,Website,Userability/Performance/Navigation
4,Keep me logged in once I log in,Website,Logged Out/Repeat Log Ins/Password Help
3,The process to confirm an online order placed by a parent is overly complicated & redundant.,Website,Userability/Performance/Navigation
4,A couple search challenges. Typed in a book I knew was there and it didn't come up.,Website,Filter/Search Options
5,"I find the site hard to navigate.  The collections can sometimes be helpful, but it would be nice to be able to just look through all titles at once.",Website,Filter/Search Options
4,It timed out and did not keep what I had done. I had to re-enter everything.,Website,Shopping Cart/Checkout
4,I cannot print or download the parent letter.,Website,Parent Letter
5,Some of the digital flyers would not load to view.,Website,Digital Flyer
4,"It would be great if teachers/parents could search by price (for example in the search bar enter ""$1"" and all the $1 books came up)",Website,Filter/Search Options
4,The button to SEE ALL in a section doesn't stand out easily,Website,Userability/Performance/Navigation
5,"Site is easy to navigate. However, I did not see the bonus catalog section. I will look when I submit order on Wednesday.  Thanks for the $1.00 book section. helps me with birthday books and holiday books.",Website,Filter/Search Options
4,It would be great if you had a way to sort by price or browse for books below a certain price point.,Website,Filter/Search Options
3,cant search for a book,Website,Filter/Search Options
4,"I wish there was a way to search or sort by price. For example, as a parent (or a teacher) looking to build my library on a tight budget, I'd love to search for all the $5 and under books. Or knowing that Scholastic has dollar deals, all the $2 books.",Website,Filter/Search Options
3,Just initial navigation is a little confusing,Website,Userability/Performance/Navigation
4,The way the free book code needed to be entered was a bit confusing. I ended up ordering two copies of the same book.,Website,Filter/Search Options
1,The page is stuck on the check out screen  Very frustrating,Website,Userability/Performance/Navigation
3,"I tried on my phone to enter a free book and submit my order,but it did not work so I went on my computer and tried and it worked.",Website,Mobile Compatibility
1,It said general error.,Website,Userability/Performance/Navigation
3,"I am truly not trying to sound negative or that I'm complaining, but your website is incredibly difficult to navigate. There are WAY to many things to look on every page that I go to. Perhaps student orders can show up as JUST their names with a drop down option if you want to see what they've ordered? I don't know... it's just really challenging every time I come to this site. Like I said, I'm NOT trying to complain... I LOVE children's books and I LOVE promoting them. I just have a really hard time on your website. Thank you",Website,Userability/Performance/Navigation
3,I can't find filters and I wanted to filter by price.,Website,Filter/Search Options
2,"Very slow, site freezing.",Website,Userability/Performance/Navigation
4,I was unable to find the book packs listed on the cover pages of the flyers sent to me.  I wasn't sure where to find them.   It was also difficult to see the text when I was viewing sample pages.  Sometimes I was able to get it to zoom in on the words by moving my mouse over and sometimes it would not.   It was also frustrating to have to keep clicking on the see full details button to read a description of the story.,Website,Userability/Performance/Navigation
3,"I read the tutorial, but found it a little difficult to navigate the site and look at books. After I ordered I realized there were a LOT more books to choose from than I had seen. Oh well, next time. The prices are good. Not all books had a description of the story",Website,Userability/Performance/Navigation
1,Rested an account one for each child then could not get to a place to order for youngest. I was stuck at the oldest.   Will go out and try again,Website,Userability/Performance/Navigation
3,I had trouble viewing the digital flyer.,Website,Userability/Performance/Navigation
3,"I am unsure if I sent the email to parents. I was in the middle of adding students and I was told that my time expired. However, when entering names, I thought I could download the list but I saw that all those names came up as one student. Then, I could not delete my error so I had to continue and add students  one at a time. This involved typing name, clicking add, having to click in box again to type another name., etc. Then time expired and I do not know what students I have listed.   I did not continue because it would take more time.    I did share the SBC to 2 of our new colleagues. I hope they do not get discouraged.",Website,Userability/Performance/Navigation
3,Very slow to load,Website,Userability/Performance/Navigation
4,"The hover behavior where it opens a dialog when you're in the catalog view is a little weird, but it works.    Tried to search for ""how it's built"" books, and the search definitely seems like it could use improvement. No results for ""sailboat"" even though there's a sailboat book in there.",Website,Filter/Search Options
4,"Below ,in this survey , you asked me if I need assistance ( which I don't ) , then my email was required regardless. Why?",Website,Survey Pop Up
5,"I completed the survery before I was able to put in my order for it popped up as I was about to do the order/bonus part of the website. The survey should come up at the end, not at the start.",Website,Survey Pop Up
3,There were so many pop ups and notifications it was hard to see where I had to go and where to enter the actual order. Please make it more user friendly. thank you,Website,Userability/Performance/Navigation
4,I wish that you could also search for books by price.  I often have money to spend (earned rewards) and sometimes difficult to spend the exact amount.  Being able to search by price would help with this process.,Website,Filter/Search Options
3,I would love to be able to search books by reading level (vs. age level).,Website,Filter/Search Options
4,it logged me out after a few minutes of inactivity but once i logged back in all my items were still in my shopping cart,Website,Logged Out/Repeat Log Ins/Password Help
3,"Maybe I am just missing it, but I really wish I could find books by the skill level of the reader better. My son has dyslexia and isn't reading at his grade level, so it makes finding books for him on this site difficult.",Website,Filter/Search Options
4,It's not user friendly unless you are knowledgeable with the site,Website,Userability/Performance/Navigation
4,Some parts wouldn't load. It would also be nice if you could add to cart straight from the brochure page,Website,Userability/Performance/Navigation
3,"When my account pulls up, it pulls up to my parent account.  I want it to pull up to my teacher account.  I guess I will have to cancel the parent account because otherwise I have to try to figure out how to see student orders- it's not very user friendly.    When you pull up the flyer view, it won't let you go to the next page if you zoom in to look at anything.  You should still be able to click the arrow to turn the page even if you zoom in to see a book description instead of going all the way out and starting over.",Website,Userability/Performance/Navigation
4,Would like option to have a quick translated Spanish version  of the Family Letter - Could not find.  Thank you   -    The website gets improved each year - and teachers/parents really appreciate that.,Website,Parent Letter
3,"Some of the features on the website are a little difficult to manage on various devices--the popups (while helpful at times) often get in the way of the task at hand.  The website was very difficult to use on an iPad, but much better on a laptop.",Website,Mobile Compatibility
4,It's hard to find the exact books on the teacher's list.,Website,Filter/Search Options
3,"I would appreciate an easier way to look at the flyers...maybe in alphabetical list for with a picture of the book  beside each listing.    It would also be wonderful if there were more books available with a Christian theme, especially at Christmas and Easter.",Website,Digital Flyer
2,"Historically, I find the Scholastic Book Club site very challenging to navigate",Website,Userability/Performance/Navigation
1,"The site loads slowly, shows books I don't click on. The digital flyer is clever but not user-friendly. At all. A different format (maybe that looks less likely the flyer) would work better.",Website,Digital Flyer
1,"The interface takes me in circles when I'm trying to find something. It has always been challenging to have a teacher and parent account simultaneously, they do not pair well together. Very frustrated that my account is under a parent and I have no way to change it to an educator. I just want flyers to send to my students and have no way to access it or request flyers.",Website,Userability/Performance/Navigation
1,"I can't add anything to my cart!  I click the black ADD TO CART button, and a pop-up says the item is added, but when I go to the cart it is empty.  This site is useless.",Website,Shopping Cart/Checkout
4,It’s difficult to swipe right and see all the books in a category.,Website,Mobile Compatibility
1,"Every time I add a book to cart, I get a pop-up that says added to cart, but then the cart is still empty.",Website,Shopping Cart/Checkout
2,"I can't find two students who placed an order.  My cart is empty, but it says I have two students who ordered.  I really hope this isn't a repeat of last year when I waited from Sept. to the end of Nov. for my first book order....",Website,Shopping Cart/Checkout
4,It would be nice to shop by flyer without having to download every flyer,Website,Digital Flyer
4,"The website (and this could be operator error) would get stuck as I was trying to place the orders.  It would not let me scroll down the list of the catelog to check certain books.  I had to refresh and then it let me scroll down.  Otherwise, I like the option of being able to look at the flyer and having items shipped to my home so that they are not lost at the school. or if we need to go virtual with the pandemic.  Thank you for making these changes.  I have always loved Scholastic book club.",Website,Shopping Cart/Checkout
5,"Was a little overwhelming to sort through the flyers and try to present options to my kindergartner, but got it done!",Website,Digital Flyer
1,Congratulations- my new password for this site contains the words This is stupid.  I have been a parent ordering books for almost 10 years and the absolutely ridiculous crap I had to go through to log back in after forgetting my password was exceedingly frustrating.  What a waste of my time.  Next time I will go to the bookstore or library to get my kids’ books.  The drive will take less time.  I couldn’t even complete my order before this stupid survey popped up.,Website,Survey Pop Up
4,"Still getting used to using the online, but I was not able to get back to the teachers list after I chose some books. Not sure if that's a user issue but I wish there was a visible tab to get back to that after making selections and checking my cart to see what my total was at. my intention was to spend 25 and then spend the $5 on a book for the teacher and I could figure out where her requests were.",Website,Userability/Performance/Navigation
3,"After selecting a book description, it's difficult to get back to the page where you can select a different flyer.    I would prefer more individual books instead of a pack of several.",Website,Digital Flyer
2,"First, what the heck is the difference between a book fair and a book store? Why does it still look like I'm benefiting my niece's old school from past years, when I tried to sign up with my daughter's new school? Your flyers stopped loading for me after I'd looked at several. The cart doesn't have an easily visible total... I have to scroll all the way to the bottom, which feels like extra work when I just want to know where things stand before I add more books (or subtract some).",Website,Userability/Performance/Navigation
4,I couldn't add the free book from the mobile site it wouldn't let me scroll down to submit.  So i had to pull it up on my laptop to get the free book saved.,Website,Mobile Compatibility
3,"Even after typing in the title of the book that I was looking for, the site took a long time to find the item.",Website,Filter/Search Options
4,The page was slow to load. Not sure if it was the website or my computer though.,Website,Userability/Performance/Navigation
3,Hard to search for books.,Website,Filter/Search Options
2,"The links provided on the flyer didn’t work. I had to search and find the site , navigation was frustrating.",Website,Userability/Performance/Navigation
3,Could not get the site to work on the Chrome browser even with cookies unblocked.,Website,Userability/Performance/Navigation
1,Website is slow to respond and download.,Website,Userability/Performance/Navigation
3,Seemed hard to search for books.,Website,Filter/Search Options
3,The only issue was having the Feedback and Live Chat on the right side made it difficult to move up and down the page on my laptop.,Website,Userability/Performance/Navigation
3,"There is a black rectangle on the THANK YOU FOR YOUR ORDER page with the word PRINT that did not print. I chatted with your rep Christopher, but he was unable to fix the problem. He said he would submit it to your tech people.",Website,Userability/Performance/Navigation
3,how about some tutorial videos on how to...?,Website,Userability/Performance/Navigation
3,"It is just not easy to find things on your website. Since I work on line, I need to be ale to quickly and easily see if  my students have made orders so that I can submit them.  That is not an easy thing to find.",Website,Filter/Search Options
4,DON'T SEE HOW TO SHARE FLYER WITH A PARENT,Website,Digital Flyer
1,When I click sign in a white blank box comes up and I am unable to sign in.  I can sign in at my school but not at home. I tried connecting to my hotspot- that didn't work either. Why can I not sign in at home?,Website,Logged Out/Repeat Log Ins/Password Help
4,The only difficulty is shopping or making Teacher Selections by level. I wish there was a way to search books by reading level.,Website,Filter/Search Options
4,I thought this was pretty straight forward. My only thing was that it took me a moment to find the button to see all books in the age group I selected rather than just a sample of what was available. Once I saw that link everything else was easy.,Website,Filter/Search Options
5,"When I tried to download my Family Letter, it would not open to the letter. The site stated it was not found.",Website,Parent Letter
4,If it is possible to look at books by theme a little easier it would be nice.,Website,Filter/Search Options
4,not enough books displayed on a page when looking at fiction books.  Too many pages to click through.,Website,Userability/Performance/Navigation
4,"There was a $1 books offer that opened to me, but when I switched pages I couldn't find it again. I was going to go back and get some but couldn't access it easily. Otherwise no problems.",Website,Userability/Performance/Navigation
3,"the suggestions of books are very small, and it should have an option to search books by themes.",Website,Filter/Search Options
4,"I'm still learning how to navigate to what I need. Sometimes, it's not as intuitive as I'd like. Overall, I've had a positive experience with the site.",Website,Userability/Performance/Navigation
2,Please allow for author searching and linking. Subjects as well. Sort filter features by price and reading level while I'm dreaming.,Website,Filter/Search Options
2,It is just not user friendly. Lots of scrolling. and the information you're looking for is not really in the place you are looking for it to be in.,Website,Userability/Performance/Navigation
3,"When on mobile, hard to find how to order for book club to benefit classroom.",Website,Mobile Compatibility
4,Sign in period is too short.  Most times when browsing I need to come back and find I've been signed out.  It's just annoying to sign back in is all.,Website,Logged Out/Repeat Log Ins/Password Help
3,"I don't think it's the most user friendly site. Also, I don't appreciate how Scholastic has raised the price so much that most of our families can't afford to get the books anymore.",Website,Userability/Performance/Navigation
4,It is annoying to me that the site works best in landscape over portrait on my iPad. I usually forget to turn it.,Website,Mobile Compatibility
4,"The search functions are a little antiquated, but I was able to complete, thanks!",Website,Filter/Search Options
4,"i wasn't able to find a way to search by topic, like self regulation.  I just had to hope it came up.  You should have a tab for kids on spectrum.  Maybe you do but it wasn't obvious.",Website,Filter/Search Options
5,"Some trouble logging in - didn't accept password, but overall easier than usual.  As I've said before your site doesn't do well with Mozilla and other browsers that focus on privacy which is annoying as I have to use chrome or edge - whichever will work that day.  Also, my biggest pain is trying to enter the due dates.  Often the Drop-down calendar will not register my date.  It would be preferable to have an option to type in a date.  Thank you - hoping things are running more smoothly this year.",Website,Userability/Performance/Navigation
1,It will not let me order books. Nothing shows in my cart,Website,Shopping Cart/Checkout
5,"if possible filters allowing me too look at subjects per age.  For example... fears/anxiety & age  options with 'where is my monster'.  Also maybe select value packs as alternate purchases when you select a particular book.   I found the above example after searching examples, then put it directly in to see if you had the book as an option.  After I completed my order I discovered there was a value pack with another similar book.",Website,Filter/Search Options
4,When searching for books to add the site often lags.,Website,Userability/Performance/Navigation
1,website is not formulated to be used with a cellphone. wouldnt even let me submit payment on my cellphone i had to use a desktop computer.,Website,Mobile Compatibility
3,"I put items in my cart, but the site would not let me log in so I could buy the books I wanted to purchase. I had an account last year and my grandson s now in first grade, so i need to chanfge classrooms, which i did, but then I could not log in. I tried to create a new account, but could not do that either. I am not impressed with your website a the moment.",Website,Shopping Cart/Checkout
