OverallRating,Comment,FeedbackCategory,Subcategory
4,The scroll side bar is so skinny to move.  I hope shipping timeline has improved to pre pandemic schedule.,Website,Userability/Performance/Navigation
3,Password reset,Website,Logged Out/Repeat Log Ins/Password Help
4,"not hard, but not very easy finding the right flyer to order the books",Website,Digital Flyer
4,I tried to pull up the2nd & 4th grade flyers to view. they never came up even after I clicked the help if  having trouble,Website,Digital Flyer
5,The digital flyer wouldn't always come up,Website,Digital Flyer
4,It would be great if you could search by lexile/reading level.  Or even if you could easily access flyers from other grades as my child is reading above her grade level.,Website,Filter/Search Options
4,It was hard to get to the flyers but overall it was a good visit!,Website,Digital Flyer
4,"Not difficulties per se, but the website doesn't always feel intuitive for figuring out how to do what I need as a teacher. This is only my second year, so maybe that's why.",Website,Userability/Performance/Navigation
5,"I couldn't remember my password but if I had known the ""requirements"" I would've been able to remember it.  Maybe it would be helpful to know how many characters the passwords are?",Website,Logged Out/Repeat Log Ins/Password Help
4,"It can be hard to find books even with the search feature.  For instance I typed in ""Babysitters Club"" and it only offered me the 5 book pack, but I knew there was an individual book available.",Website,Filter/Search Options
1,Unable to get to the Cary to purchase.,Website,Shopping Cart/Checkout
5,Is there a better way to search for all non-book items that are available to purchase? My middle schooler likes the posters and other items that are usually available during the book fairs. I was unable to locate any of those items during my search.,Website,Filter/Search Options
5,It sent me straight to the survey before I could order. I will do so now.,Website,Survey Pop Up
4,the flyers are glitchy,Website,Digital Flyer
4,I had a hard time trying to change my password.,Website,Logged Out/Repeat Log Ins/Password Help
2,"I am unable to find books via searching. I searched for the title  ""Marcus Makes a Movie"" and the author ""Kevin Hart,"" among others and the books in your flyer did not come up. I used to work in a library so I know how to search books. I was able to use the item number, but it's absurd that using the titles of the book does not work. I am 5 with how poor your site operates.",Website,Filter/Search Options
4,Sometimes the digital flyers would not load and I would have to keep refreshing the page. Other than that I am a big Scholastic fan and love ordering books!,Website,Digital Flyer
3,difficult to figure out where to make changes to account.  Site not clear.,Website,Userability/Performance/Navigation
4,"I like being able to see tons and tons of books, but I wish there was an option to search based on price and not by grade or age. I really like the selection of suggested books at the bottom of the page after you click on a book. I feel like there are so many books I am missing and struggle to be able to search appropriately on my phone.",Website,Filter/Search Options
4,"I like being able to see tons and tons of books, but I wish there was an option to search based on price and not by grade or age. I really like the selection of suggested books at the bottom of the page after you click on a book. I feel like there are so many books I am missing and struggle to be able to search appropriately on my phone.",Website,Mobile Compatibility
5,"Took a long time to load, just closed the page and re-opened it about an hour later and all is good.",Website,Userability/Performance/Navigation
5,Flyers take a long time to load,Website,Digital Flyer
4,Please add filters to narrow down search. Grade/Price/theme all on same page.,Website,Filter/Search Options
1,"Page isn't formatted to view on Android mobile. The page is too big for mobile viewing. Can't see all the books when scrolling, it ""skips"" over half of them.",Website,Mobile Compatibility
1,This website is goddawful. I can’t figure out how to make an order and your tutorial only shows me how to send reminders and links to friends and family. I’ve been here ten minutes and I can’t figure it out. Fix your website. It sucks.,Website,Userability/Performance/Navigation
